{
  "schema": "series/v1",
  "id": "nbs-consumption-housing",
  "name_zh": "居住消费支出",
  "name_en": "Housing consumption expenditure",
  "unit_zh": "元",
  "unit_en": "CNY",
  "value_type": "level",
  "freq": "Q",
  "calibers": ["ytd"],
  "source": {
    "agency": "nbs",
    "dataset_zh": "国家统计局住户收支调查 · 居住消费支出",
    "dataset_en": "NBS Household Income and Expenditure Survey — Housing consumption expenditure",
    "url": "https://www.stats.gov.cn/sj/zxfb/"
  },
  "derived": null,
  "coverage_note_zh": "2017年一季度起为完整居民收入和消费支出发布稿口径；2013-2016年为历史补充层，仅补入官方页面可核验的指标，缺项留空。",
  "observations": [
    {"period": "2017-Q1", "ytd": 978.0, "ytd_yoy": 8.9, "src": "legacy:2017-03"},
    {"period": "2017-Q2", "ytd": 1919.0, "ytd_yoy": 8.3, "src": "legacy:2017-06"},
    {"period": "2017-Q3", "ytd": 2915.0, "ytd_yoy": 9.0, "src": "legacy:2017-09"},
    {"period": "2017-Q4", "ytd": 4107.0, "ytd_yoy": 9.6, "src": "legacy:2017-12"},
    {"period": "2018-Q1", "ytd": 1107.0, "ytd_yoy": 13.1, "src": "legacy:2018-03"},
    {"period": "2018-Q2", "ytd": 2157.0, "ytd_yoy": 12.4, "src": "legacy:2018-06"},
    {"period": "2018-Q3", "ytd": 3269.0, "ytd_yoy": 12.2, "src": "legacy:2018-09"},
    {"period": "2018-Q4", "ytd": 4647.0, "ytd_yoy": 13.1, "src": "legacy:2018-12"},
    {"period": "2019-Q1", "ytd": 1212.0, "ytd_yoy": 9.5, "src": "legacy:2019-03"},
    {"period": "2019-Q2", "ytd": 2389.0, "ytd_yoy": 10.8, "src": "legacy:2019-06"},
    {"period": "2019-Q3", "ytd": 3607.0, "ytd_yoy": 10.3, "src": "legacy:2019-09"},
    {"period": "2019-Q4", "ytd": 5055.0, "ytd_yoy": 8.8, "src": "legacy:2019-12"},
    {"period": "2020-Q1", "ytd": 1238.0, "ytd_yoy": 2.1, "src": "legacy:2020-03"},
    {"period": "2020-Q2", "ytd": 2464.0, "ytd_yoy": 3.1, "src": "legacy:2020-06"},
    {"period": "2020-Q3", "ytd": 3736.0, "ytd_yoy": 3.6, "src": "legacy:2020-09"},
    {"period": "2020-Q4", "ytd": 5215.0, "ytd_yoy": 3.2, "src": "legacy:2020-12"},
    {"period": "2021-Q1", "ytd": 1345.0, "ytd_yoy": 8.7, "src": "legacy:2021-03"},
    {"period": "2021-Q2", "ytd": 2649.0, "ytd_yoy": 7.5, "src": "legacy:2021-06"},
    {"period": "2021-Q3", "ytd": 4031.0, "ytd_yoy": 7.9, "src": "legacy:2021-09"},
    {"period": "2021-Q4", "ytd": 5641.0, "ytd_yoy": 8.2, "src": "legacy:2021-12"},
    {"period": "2022-Q1", "ytd": 1435.0, "ytd_yoy": 6.7, "src": "legacy:2022-03"},
    {"period": "2022-Q2", "ytd": 2807.0, "ytd_yoy": 6.0, "src": "legacy:2022-06"},
    {"period": "2022-Q3", "ytd": 4243.0, "ytd_yoy": 5.3, "src": "legacy:2022-09"},
    {"period": "2022-Q4", "ytd": 5882.0, "ytd_yoy": 4.3, "src": "legacy:2022-12"},
    {"period": "2023-Q1", "ytd": 1560.0, "ytd_yoy": 8.7, "src": "legacy:2023-03"},
    {"period": "2023-Q2", "ytd": 2949.0, "ytd_yoy": 5.1, "src": "legacy:2023-06"},
    {"period": "2023-Q3", "ytd": 4514.0, "ytd_yoy": 6.4, "src": "legacy:2023-09"},
    {"period": "2023-Q4", "ytd": 6095.0, "ytd_yoy": 3.6, "src": "legacy:2023-12"},
    {"period": "2024-Q1", "ytd": 1562.0, "ytd_yoy": 0.1, "src": "legacy:2024-03"},
    {"period": "2024-Q2", "ytd": 3004.0, "ytd_yoy": 1.9, "src": "rel:20240715"},
    {"period": "2024-Q3", "ytd": 4560.0, "ytd_yoy": 1.0, "src": "rel:20241018"},
    {"period": "2024-Q4", "ytd": 6263.0, "ytd_yoy": 2.8, "src": "rel:20250117"},
    {"period": "2025-Q1", "ytd": 1595.0, "ytd_yoy": 2.1, "src": "rel:20250416"},
    {"period": "2025-Q2", "ytd": 3092.0, "ytd_yoy": 2.9, "src": "legacy:2025-06"},
    {"period": "2025-Q3", "ytd": 4665.0, "ytd_yoy": 2.3, "src": "rel:20251020"},
    {"period": "2025-Q4", "ytd": 6397.0, "ytd_yoy": 2.1, "src": "rel:20260119"},
    {"period": "2026-Q1", "ytd": 1611.0, "ytd_yoy": 1.0, "src": "rel:20260416"}
  ],
  "revisions": [],
  "breaks": [],
  "generated_at": "2026-07-08T00:00:00Z"
}
