{
  "schema": "series/v1",
  "id": "nbs-retail-ex-auto",
  "name_zh": "除汽车以外的消费品零售额",
  "name_en": "Retail sales excluding automobiles",
  "unit_zh": "亿元",
  "unit_en": "100M CNY",
  "value_type": "level",
  "freq": "M",
  "calibers": [
    "single",
    "ytd"
  ],
  "source": {
    "agency": "nbs",
    "dataset_zh": "国家统计局数据发布 · 除汽车以外的消费品零售额",
    "dataset_en": "NBS Data Release — Retail sales excluding automobiles",
    "url": "https://www.stats.gov.cn/sj/zxfb/"
  },
  "derived": null,
  "coverage_note_zh": "新版国家数据接口已补入可取得的当期月度序列：社会消费品零售总额最早为 1985-01；除汽车以外、汽车拆分仍以发布稿可解析范围为准；网上商品零售额当期值由官方累计值按月差推导。",
  "observations": [
    {"period": "2019-10", "m": 34876, "m_yoy": 8.3, "ytd": 303066, "ytd_yoy": 9, "src": "legacy:2019-10"},
    {"period": "2019-11", "m": 34629, "m_yoy": 9.1, "ytd": 337951, "ytd_yoy": 9, "src": "legacy:2019-11"},
    {"period": "2020-10", "m": 34868, "m_yoy": 3.6, "ytd": 281428, "ytd_yoy": -6, "src": "legacy:2020-10"},
    {"period": "2020-11", "m": 35497, "m_yoy": 4.2, "ytd": 316884, "ytd_yoy": -5, "src": "legacy:2020-11"},
    {"period": "2021-06", "m": 33719, "m_yoy": 13.1, "ytd": 189997, "ytd_yoy": 22.2, "src": "legacy:2021-06"},
    {"period": "2021-07", "m": 31578, "m_yoy": 9.7, "ytd": 221631, "ytd_yoy": 20.2, "src": "legacy:2021-07"},
    {"period": "2021-08", "m": 31115, "m_yoy": 3.6, "ytd": 252739, "ytd_yoy": 17.8, "src": "legacy:2021-08"},
    {"period": "2021-09", "m": 33298, "m_yoy": 6.4, "ytd": 285992, "ytd_yoy": 16.3, "src": "legacy:2021-09"},
    {"period": "2021-10", "m": 37057, "m_yoy": 6.7, "ytd": 323128, "ytd_yoy": 15.1, "src": "legacy:2021-10"},
    {"period": "2021-11", "m": 37266, "m_yoy": 5.4, "ytd": 360339, "ytd_yoy": 14, "src": "legacy:2021-11"},
    {"period": "2022-04", "m": 26916, "m_yoy": -8.4, "ytd": 124807, "ytd_yoy": 0.8, "src": "legacy:2022-04"},
    {"period": "2022-05", "m": 30361, "m_yoy": -5.6, "ytd": 155095, "ytd_yoy": -0.5, "src": "legacy:2022-05"},
    {"period": "2022-06", "m": 34192, "m_yoy": 1.8, "ytd": 189251, "ytd_yoy": -0.1, "src": "legacy:2022-06"},
    {"period": "2022-07", "m": 32046, "m_yoy": 1.9, "ytd": 221332, "ytd_yoy": 0.2, "src": "legacy:2022-07"},
    {"period": "2022-08", "m": 32283, "m_yoy": 4.3, "ytd": 253662, "ytd_yoy": 0.7, "src": "legacy:2022-08"},
    {"period": "2022-09", "m": 33532, "m_yoy": 1.2, "ytd": 287131, "ytd_yoy": 0.7, "src": "legacy:2022-09"},
    {"period": "2022-10", "m": 36575, "m_yoy": -0.9, "ytd": 323702, "ytd_yoy": 0.5, "src": "legacy:2022-10"},
    {"period": "2022-11", "m": 34828, "m_yoy": -6.1, "ytd": 358490, "ytd_yoy": -0.2, "src": "legacy:2022-11"},
    {"period": "2023-03", "m": 33591, "m_yoy": 10.5, "ytd": 104094, "ytd_yoy": 6.8, "src": "legacy:2023-03"},
    {"period": "2023-04", "m": 31290, "m_yoy": 16.5, "ytd": 135719, "ytd_yoy": 9, "src": "legacy:2023-04"},
    {"period": "2023-05", "m": 33875, "m_yoy": 11.5, "ytd": 169743, "ytd_yoy": 9.4, "src": "legacy:2023-05"},
    {"period": "2023-07", "m": 32906, "m_yoy": 3, "ytd": 238083, "ytd_yoy": 7.5, "src": "legacy:2023-07"},
    {"period": "2023-08", "m": 33820, "m_yoy": 5.1, "ytd": 271888, "ytd_yoy": 7.2, "src": "legacy:2023-08"},
    {"period": "2023-09", "m": 35443, "m_yoy": 5.9, "ytd": 307270, "ytd_yoy": 7, "src": "legacy:2023-09"},
    {"period": "2023-10", "m": 39198, "m_yoy": 7.2, "ytd": 346472, "ytd_yoy": 7, "src": "legacy:2023-10"},
    {"period": "2023-11", "m": 38191, "m_yoy": 9.6, "ytd": 384665, "ytd_yoy": 7.3, "src": "legacy:2023-11"},
    {"period": "2023-12", "m": 38131, "m_yoy": 7.9, "ytd": 422881, "ytd_yoy": 7.3, "src": "legacy:2023-12"},
    {"period": "2024-03", "m": 34968, "m_yoy": 3.9, "ytd": 109163, "ytd_yoy": 4.7, "src": "legacy:2024-03"},
    {"period": "2024-04", "m": 32196, "m_yoy": 3.2, "ytd": 141396, "ytd_yoy": 4.3, "src": "legacy:2024-04"},
    {"period": "2024-05", "m": 35336, "m_yoy": 4.7, "ytd": 176707, "ytd_yoy": 4.4, "src": "legacy:2024-05"},
    {"period": "2024-06", "m": 36364, "m_yoy": 3, "ytd": 213007, "ytd_yoy": 4.1, "src": "rel:20240715"},
    {"period": "2024-07", "m": 33959, "m_yoy": 3.6, "ytd": 246990, "ytd_yoy": 4, "src": "rel:20240815"},
    {"period": "2024-08", "m": 34783, "m_yoy": 3.3, "ytd": 281772, "ytd_yoy": 3.9, "src": "rel:20240914"},
    {"period": "2024-09", "m": 36573, "m_yoy": 3.6, "ytd": 318203, "ytd_yoy": 3.8, "src": "rel:20241018"},
    {"period": "2024-10", "m": 40944, "m_yoy": 4.9, "ytd": 359039, "ytd_yoy": 3.9, "src": "rel:20241115"},
    {"period": "2024-11", "m": 38998, "m_yoy": 2.5, "ytd": 397960, "ytd_yoy": 3.7, "src": "rel:20241216"},
    {"period": "2024-12", "m": 39509, "m_yoy": 4.2, "ytd": 437581, "ytd_yoy": 3.8, "src": "rel:20250117"},
    {"period": "2025-03", "m": 36610, "m_yoy": 6, "ytd": 113434, "ytd_yoy": 5.1, "src": "rel:20250416"},
    {"period": "2025-04", "m": 33548, "m_yoy": 5.6, "ytd": 147005, "ytd_yoy": 5.2, "src": "rel:20250519"},
    {"period": "2025-05", "m": 37316, "m_yoy": 7, "ytd": 184324, "ytd_yoy": 5.6, "src": "rel:20250616"},
    {"period": "2025-06", "m": 37649, "m_yoy": 4.8, "ytd": 221990, "ytd_yoy": 5.5, "src": "rel:20250715"},
    {"period": "2025-07", "m": 34931, "m_yoy": 4.3, "ytd": 257014, "ytd_yoy": 5.3, "src": "rel:20250815"},
    {"period": "2025-08", "m": 35575, "m_yoy": 3.7, "ytd": 292643, "ytd_yoy": 5.1, "src": "rel:20250915"},
    {"period": "2025-09", "m": 37260, "m_yoy": 3.2, "ytd": 329954, "ytd_yoy": 4.9, "src": "rel:20251020"},
    {"period": "2025-10", "m": 42036, "m_yoy": 4, "ytd": 372160, "ytd_yoy": 4.9, "src": "rel:20251114"},
    {"period": "2025-11", "m": 39444, "m_yoy": 2.5, "ytd": 411637, "ytd_yoy": 4.6, "src": "rel:20251215"},
    {"period": "2025-12", "m": 39654, "m_yoy": 1.7, "ytd": 451413, "ytd_yoy": 4.4, "src": "rel:20260119"},
    {"period": "2026-03", "m": 37875, "m_yoy": 3.2, "ytd": 117727, "ytd_yoy": 3.6, "src": "rel:20260416"},
    {"period": "2026-04", "m": 34218, "m_yoy": 1.8, "ytd": 152053, "ytd_yoy": 3.1, "src": "rel:20260518"},
    {"period": "2026-05", "m": 37781, "m_yoy": 1.1, "ytd": 190022, "ytd_yoy": 2.7, "src": "rel:20260616"},
    {"period": "2026-06", "m": 38900.0, "m_yoy": 3.0, "ytd": 229034.0, "ytd_yoy": 2.8},
    {"period": "2026-07", "m": 35892.0, "m_yoy": 2.5, "ytd": 265142.0, "ytd_yoy": 2.7},
    {"period": "2026-08", "m": 36545.0, "m_yoy": 2.5, "ytd": 301764.0, "ytd_yoy": 2.7},
    {"period": "2026-09", "m": 38792.0, "m_yoy": 3.9, "ytd": 340574.0, "ytd_yoy": 2.8}
  ],
  "revisions": [],
  "breaks": [],
  "generated_at": "2026-10-19T03:55:14.827695+00:00"
}
