{
  "schema": "series/v1",
  "id": "nbs-income-disposable-rural",
  "name_zh": "农村居民人均可支配收入",
  "name_en": "Rural per capita disposable income",
  "unit_zh": "元",
  "unit_en": "CNY",
  "value_type": "level",
  "freq": "Q",
  "calibers": ["ytd"],
  "source": {
    "agency": "nbs",
    "dataset_zh": "国家统计局住户收支调查 · 农村居民人均可支配收入",
    "dataset_en": "NBS Household Income and Expenditure Survey — Rural per capita disposable income",
    "url": "https://www.stats.gov.cn/sj/zxfb/"
  },
  "derived": null,
  "coverage_note_zh": "2017年一季度起为完整居民收入和消费支出发布稿口径；2013-2016年为历史补充层，仅补入官方页面可核验的指标，缺项留空。",
  "observations": [
    {"period": "2014", "freq": "A", "ytd": 10489.0, "ytd_yoy": null, "real_yoy": null, "src": "legacy-annual-bulletin"},
    {"period": "2015", "freq": "A", "ytd": 11422.0, "ytd_yoy": null, "real_yoy": null, "src": "legacy-annual-bulletin"},
    {"period": "2016", "freq": "A", "ytd": 12363.0, "ytd_yoy": 8.2, "real_yoy": null, "src": "legacy-annual-bulletin"},
    {"period": "2016-Q1", "ytd": 3578.0, "ytd_yoy": 9.1, "real_yoy": null, "src": "legacy-annual-bulletin"},
    {"period": "2016-Q2", "ytd": 6050.0, "ytd_yoy": 8.9, "real_yoy": null, "src": "legacy-annual-bulletin"},
    {"period": "2017-Q1", "ytd": 3060.0, "ytd_yoy": 7.1, "real_yoy": null, "src": "legacy:2017-03"},
    {"period": "2017-Q2", "ytd": 5559.0, "ytd_yoy": 7.0, "real_yoy": null, "src": "legacy:2017-06"},
    {"period": "2017-Q3", "ytd": 8466.0, "ytd_yoy": 8.2, "real_yoy": null, "src": "legacy:2017-09"},
    {"period": "2017-Q4", "ytd": 11969.0, "ytd_yoy": 7.4, "real_yoy": null, "src": "legacy:2017-12"},
    {"period": "2018-Q1", "ytd": 3363.0, "ytd_yoy": 9.9, "real_yoy": null, "src": "legacy:2018-03"},
    {"period": "2018-Q2", "ytd": 6045.0, "ytd_yoy": 8.7, "real_yoy": null, "src": "legacy:2018-06"},
    {"period": "2018-Q3", "ytd": 9248.0, "ytd_yoy": 9.2, "real_yoy": null, "src": "legacy:2018-09"},
    {"period": "2018-Q4", "ytd": 13066.0, "ytd_yoy": 9.2, "real_yoy": null, "src": "legacy:2018-12"},
    {"period": "2019-Q1", "ytd": 3663.0, "ytd_yoy": 8.9, "real_yoy": null, "src": "legacy:2019-03"},
    {"period": "2019-Q2", "ytd": 6601.0, "ytd_yoy": 9.2, "real_yoy": null, "src": "legacy:2019-06"},
    {"period": "2019-Q3", "ytd": 10172.0, "ytd_yoy": 10.0, "real_yoy": null, "src": "legacy:2019-09"},
    {"period": "2019-Q4", "ytd": 14389.0, "ytd_yoy": 10.1, "real_yoy": null, "src": "legacy:2019-12"},
    {"period": "2020-Q1", "ytd": 3625.0, "ytd_yoy": -1.0, "real_yoy": null, "src": "legacy:2020-03"},
    {"period": "2020-Q2", "ytd": 6682.0, "ytd_yoy": 1.2, "real_yoy": null, "src": "legacy:2020-06"},
    {"period": "2020-Q3", "ytd": 10650.0, "ytd_yoy": 4.7, "real_yoy": null, "src": "legacy:2020-09"},
    {"period": "2020-Q4", "ytd": 15204.0, "ytd_yoy": 5.7, "real_yoy": null, "src": "legacy:2020-12"},
    {"period": "2021-Q1", "ytd": 4340.0, "ytd_yoy": 19.7, "real_yoy": null, "src": "legacy:2021-03"},
    {"period": "2021-Q2", "ytd": 7956.0, "ytd_yoy": 19.1, "real_yoy": null, "src": "legacy:2021-06"},
    {"period": "2021-Q3", "ytd": 11962.0, "ytd_yoy": 12.3, "real_yoy": null, "src": "legacy:2021-09"},
    {"period": "2021-Q4", "ytd": 16902.0, "ytd_yoy": 11.2, "real_yoy": null, "src": "legacy:2021-12"},
    {"period": "2022-Q1", "ytd": 5778.0, "ytd_yoy": 7.0, "real_yoy": 6.3, "src": "legacy:2022-03"},
    {"period": "2022-Q2", "ytd": 9787.0, "ytd_yoy": 5.8, "real_yoy": 4.2, "src": "legacy:2022-06"},
    {"period": "2022-Q3", "ytd": 14600.0, "ytd_yoy": 6.4, "real_yoy": 4.3, "src": "legacy:2022-09"},
    {"period": "2022-Q4", "ytd": 20133.0, "ytd_yoy": 6.3, "real_yoy": 4.2, "src": "legacy:2022-12"},
    {"period": "2023-Q1", "ytd": 6131.0, "ytd_yoy": 6.1, "real_yoy": 4.8, "src": "legacy:2023-03"},
    {"period": "2023-Q2", "ytd": 8920.0, "ytd_yoy": 6.1, "real_yoy": null, "src": "legacy:2023-06"},
    {"period": "2023-Q3", "ytd": 13396.0, "ytd_yoy": 5.7, "real_yoy": null, "src": "legacy:2023-09"},
    {"period": "2023-Q4", "ytd": 21691.0, "ytd_yoy": 7.7, "real_yoy": 7.6, "src": "legacy:2023-12"},
    {"period": "2024-Q1", "ytd": 6596.0, "ytd_yoy": 7.6, "real_yoy": 7.7, "src": "legacy:2024-03"},
    {"period": "2024-Q2", "ytd": 11272.0, "ytd_yoy": 6.8, "real_yoy": 6.6, "src": "rel:20240715"},
    {"period": "2024-Q3", "ytd": 16740.0, "ytd_yoy": 6.6, "real_yoy": 6.3, "src": "rel:20241018"},
    {"period": "2024-Q4", "ytd": 19605.0, "ytd_yoy": 4.6, "real_yoy": null, "src": "rel:20250117"},
    {"period": "2025-Q1", "ytd": 7003.0, "ytd_yoy": 6.2, "real_yoy": 6.5, "src": "rel:20250416"},
    {"period": "2025-Q2", "ytd": 11936.0, "ytd_yoy": 5.9, "real_yoy": 6.2, "src": "legacy:2025-06"},
    {"period": "2025-Q3", "ytd": 17686.0, "ytd_yoy": 5.7, "real_yoy": 6.0, "src": "rel:20251020"},
    {"period": "2025-Q4", "ytd": 24456.0, "ytd_yoy": 5.8, "real_yoy": 6.0, "src": "rel:20260119"},
    {"period": "2026-Q1", "ytd": 7433.0, "ytd_yoy": 6.1, "real_yoy": 5.4, "src": "rel:20260416"}
  ],
  "revisions": [],
  "breaks": [],
  "generated_at": "2026-07-08T00:00:00Z"
}
