{
  "schema": "series/v1",
  "id": "nbs-retail-cat-tobacco-alcohol",
  "name_zh": "烟酒类",
  "name_en": "Tobacco and alcohol (above-quota category)",
  "unit_zh": "亿元",
  "unit_en": "100M CNY",
  "value_type": "level",
  "freq": "M",
  "calibers": [
    "single",
    "ytd"
  ],
  "source": {
    "agency": "nbs",
    "dataset_zh": "国家统计局数据发布 · 烟酒类",
    "dataset_en": "NBS Data Release — Tobacco and alcohol (above-quota category)",
    "url": "https://www.stats.gov.cn/sj/zxfb/"
  },
  "derived": null,
  "coverage_note_zh": "新版国家数据接口已补入可取得的当期月度序列：社会消费品零售总额最早为 1985-01；除汽车以外、汽车拆分仍以发布稿可解析范围为准；网上商品零售额当期值由官方累计值按月差推导。",
  "observations": [
    {"period": "2015-10", "m": 342, "m_yoy": 14.8, "ytd": 3182, "ytd_yoy": 12.4, "src": "legacy:2015-10"},
    {"period": "2015-11", "m": 364, "m_yoy": 13.9, "ytd": 3508, "ytd_yoy": 12.6, "src": "legacy:2015-11"},
    {"period": "2016-10", "m": 364, "m_yoy": 7.9, "ytd": 3432, "ytd_yoy": 9, "src": "legacy:2016-10"},
    {"period": "2016-11", "m": 397, "m_yoy": 9.7, "ytd": 3833, "ytd_yoy": 9.1, "src": "legacy:2016-11"},
    {"period": "2017-11", "m": 403, "m_yoy": 4.5, "ytd": 4053, "ytd_yoy": 8.3, "src": "legacy:2017-11"},
    {"period": "2018-10", "m": 318, "m_yoy": 1.2, "ytd": 3170, "ytd_yoy": 7.8, "src": "legacy:2018-10"},
    {"period": "2018-11", "m": 334, "m_yoy": 3.1, "ytd": 3502, "ytd_yoy": 7.3, "src": "legacy:2018-11"},
    {"period": "2019-10", "m": 308, "m_yoy": 4.4, "ytd": 3173, "ytd_yoy": 6.7, "src": "legacy:2019-10"},
    {"period": "2019-11", "m": 338, "m_yoy": 8.3, "ytd": 3503, "ytd_yoy": 6.8, "src": "legacy:2019-11"},
    {"period": "2020-10", "m": 344, "m_yoy": 15.1, "ytd": 3075, "ytd_yoy": 2.6, "src": "legacy:2020-10"},
    {"period": "2020-11", "m": 380, "m_yoy": 11.4, "ytd": 3460, "ytd_yoy": 3.5, "src": "legacy:2020-11"},
    {"period": "2021-06", "m": 392, "m_yoy": 18.2, "ytd": 2268, "ytd_yoy": 32, "src": "legacy:2021-06"},
    {"period": "2021-07", "m": 325, "m_yoy": 15.1, "ytd": 2588, "ytd_yoy": 29.6, "src": "legacy:2021-07"},
    {"period": "2021-08", "m": 349, "m_yoy": 14.4, "ytd": 2939, "ytd_yoy": 27.6, "src": "legacy:2021-08"},
    {"period": "2021-09", "m": 490, "m_yoy": 16, "ytd": 3430, "ytd_yoy": 25.8, "src": "legacy:2021-09"},
    {"period": "2021-10", "m": 389, "m_yoy": 14.3, "ytd": 3817, "ytd_yoy": 24.5, "src": "legacy:2021-10"},
    {"period": "2021-11", "m": 432, "m_yoy": 13.3, "ytd": 4262, "ytd_yoy": 23.3, "src": "legacy:2021-11"},
    {"period": "2022-04", "m": 312, "m_yoy": -7, "ytd": 1686, "ytd_yoy": 7.8, "src": "legacy:2022-04"},
    {"period": "2022-05", "m": 352, "m_yoy": 3.8, "ytd": 2051, "ytd_yoy": 7.1, "src": "legacy:2022-05"},
    {"period": "2022-06", "m": 426, "m_yoy": 5.1, "ytd": 2475, "ytd_yoy": 6.7, "src": "legacy:2022-06"},
    {"period": "2022-07", "m": 366, "m_yoy": 7.7, "ytd": 2828, "ytd_yoy": 6.9, "src": "legacy:2022-07"},
    {"period": "2022-08", "m": 395, "m_yoy": 8, "ytd": 3218, "ytd_yoy": 7, "src": "legacy:2022-08"},
    {"period": "2022-09", "m": 465, "m_yoy": -8.8, "ytd": 3688, "ytd_yoy": 4.7, "src": "legacy:2022-09"},
    {"period": "2022-10", "m": 403, "m_yoy": -0.7, "ytd": 4090, "ytd_yoy": 4.2, "src": "legacy:2022-10"},
    {"period": "2022-11", "m": 440, "m_yoy": -2, "ytd": 4525, "ytd_yoy": 3.5, "src": "legacy:2022-11"},
    {"period": "2023-03", "m": 430, "m_yoy": 9, "ytd": 1527, "ytd_yoy": 6.8, "src": "legacy:2023-03"},
    {"period": "2023-04", "m": 364, "m_yoy": 14.9, "ytd": 1830, "ytd_yoy": 8.3, "src": "legacy:2023-04"},
    {"period": "2023-05", "m": 375, "m_yoy": 8.6, "ytd": 2179, "ytd_yoy": 8.3, "src": "legacy:2023-05"},
    {"period": "2023-07", "m": 391, "m_yoy": 7.2, "ytd": 3035, "ytd_yoy": 8.4, "src": "legacy:2023-07"},
    {"period": "2023-08", "m": 414, "m_yoy": 4.3, "ytd": 3446, "ytd_yoy": 7.9, "src": "legacy:2023-08"},
    {"period": "2023-09", "m": 568, "m_yoy": 23.1, "ytd": 4026, "ytd_yoy": 9.8, "src": "legacy:2023-09"},
    {"period": "2023-10", "m": 458, "m_yoy": 15.4, "ytd": 4489, "ytd_yoy": 10.3, "src": "legacy:2023-10"},
    {"period": "2023-11", "m": 503, "m_yoy": 16.2, "ytd": 4993, "ytd_yoy": 10.9, "src": "legacy:2023-11"},
    {"period": "2023-12", "m": 543, "m_yoy": 8.3, "ytd": 5507, "ytd_yoy": 10.6, "src": "legacy:2023-12"},
    {"period": "2024-03", "m": 462, "m_yoy": 9.4, "ytd": 1729, "ytd_yoy": 12.5, "src": "legacy:2024-03"},
    {"period": "2024-04", "m": 407, "m_yoy": 8.4, "ytd": 2130, "ytd_yoy": 11.7, "src": "legacy:2024-04"},
    {"period": "2024-05", "m": 422, "m_yoy": 7.7, "ytd": 2550, "ytd_yoy": 11, "src": "legacy:2024-05"},
    {"period": "2024-06", "m": 503, "m_yoy": 5.2, "ytd": 3055, "ytd_yoy": 10, "src": "rel:20240715"},
    {"period": "2024-07", "m": 410, "m_yoy": -0.1, "ytd": 3469, "ytd_yoy": 8.7, "src": "rel:20240815"},
    {"period": "2024-08", "m": 449, "m_yoy": 3.1, "ytd": 3919, "ytd_yoy": 8, "src": "rel:20240914"},
    {"period": "2024-09", "m": 588, "m_yoy": -0.7, "ytd": 4526, "ytd_yoy": 6.8, "src": "rel:20241018"},
    {"period": "2024-10", "m": 480, "m_yoy": -0.1, "ytd": 5002, "ytd_yoy": 6.1, "src": "rel:20241115"},
    {"period": "2024-11", "m": 511, "m_yoy": -3.1, "ytd": 5524, "ytd_yoy": 5.2, "src": "rel:20241216"},
    {"period": "2024-12", "m": 632, "m_yoy": 10.4, "ytd": 6159, "ytd_yoy": 5.7, "src": "rel:20250117"},
    {"period": "2025-03", "m": 515, "m_yoy": 8.5, "ytd": 1879, "ytd_yoy": 6.3, "src": "rel:20250416"},
    {"period": "2025-04", "m": 436, "m_yoy": 4, "ytd": 2305, "ytd_yoy": 5.8, "src": "rel:20250519"},
    {"period": "2025-05", "m": 482, "m_yoy": 11.2, "ytd": 2787, "ytd_yoy": 6.7, "src": "rel:20250616"},
    {"period": "2025-06", "m": 516, "m_yoy": -0.7, "ytd": 3316, "ytd_yoy": 5.5, "src": "rel:20250715"},
    {"period": "2025-07", "m": 433, "m_yoy": 2.7, "ytd": 3740, "ytd_yoy": 5.2, "src": "rel:20250815"},
    {"period": "2025-08", "m": 450, "m_yoy": -2.3, "ytd": 4194, "ytd_yoy": 4.3, "src": "rel:20250915"},
    {"period": "2025-09", "m": 615, "m_yoy": 1.6, "ytd": 4808, "ytd_yoy": 4, "src": "rel:20251020"},
    {"period": "2025-10", "m": 511, "m_yoy": 4.1, "ytd": 5301, "ytd_yoy": 4, "src": "rel:20251114"},
    {"period": "2025-11", "m": 502, "m_yoy": -3.4, "ytd": 5790, "ytd_yoy": 3.3, "src": "rel:20251215"},
    {"period": "2025-12", "m": 623, "m_yoy": -2.9, "ytd": 6425, "ytd_yoy": 2.7, "src": "rel:20260119"},
    {"period": "2026-03", "m": 539, "m_yoy": 7.7, "ytd": 2122, "ytd_yoy": 16, "src": "rel:20260416"},
    {"period": "2026-04", "m": 471, "m_yoy": 11.7, "ytd": 2575, "ytd_yoy": 15.2, "src": "rel:20260518"},
    {"period": "2026-05", "m": 484, "m_yoy": 4.8, "ytd": 3016, "ytd_yoy": 13.4, "src": "rel:20260616"},
    {"period": "2026-06", "m": 537.0, "m_yoy": 12.1, "ytd": 3547.0, "ytd_yoy": 13.2},
    {"period": "2026-07", "m": 431.0, "m_yoy": 6.0, "ytd": 3966.0, "ytd_yoy": 12.4},
    {"period": "2026-08", "m": 475.0, "m_yoy": 12.5, "ytd": 4437.0, "ytd_yoy": 12.4},
    {"period": "2026-09", "m": 663.0, "m_yoy": 13.8, "ytd": 5105.0, "ytd_yoy": 12.6}
  ],
  "revisions": [],
  "breaks": [],
  "generated_at": "2026-10-19T03:55:14.843367+00:00"
}
